{
  "eventId": "019bd6a0-5555-7acb-85dc-415263748603",
  "occurredAt": "2026-09-12T11:00:00.0000000+00:00",
  "aggregateId": "019bd6a0-4444-7d2b-8e46-5f6071829305",
  "organisationId": "019bcf7f-9d10-7b21-84c6-5e7f8a9b0c1d",
  "branchId": "019bcf7f-a204-7f38-9c52-6d7e8f90a1b2",
  "customerId": "019bd63a-1c40-7e82-9a17-2b3c4d5e6f70",
  "invoiceId": "019bd6a0-2222-7d2b-8e46-5f6071829301",
  "documentNumber": "CN-CBE01-2627-000001",
  "grandTotal": 94.5,
  "currency": "INR",
  "eventType": "billing.credit-note-posted.v1",
  "schemaVersion": 1
}
